<?xml version = "1.0" encoding = "UTF-8"?>
<Usersinfo xmlns = "http://www.tibco.com/schemas/TibcoFeb/SharedResources/Schema/Schema.xsd" xmlns:xsi = "http://www.w3.org/2001/XMLSchema-instance" xsi:schemaLocation = "http://www.tibco.com/schemas/TibcoFeb/SharedResources/Schema/Schema.xsd UserSchema.xsd">
	<Userdata>
		<UserID>322333</UserID>
		<UserName>Vamsi</UserName>
		<UserDesignation>Software Engineer</UserDesignation>
		<UserCity>Jrg</UserCity>
	</Userdata>
	<Userdata>
		<UserID>723456</UserID>
		<UserName>Chaitanya</UserName>
		<UserDesignation>Software Developer</UserDesignation>
		<UserCity>Vizag</UserCity>
	</Userdata>
	<Userdata>
		<UserID>128734</UserID>
		<UserName>Teja</UserName>
		<UserDesignation>Engineer</UserDesignation>
		<UserCity>Vizag</UserCity>
	</Userdata>
	<Userdata>
		<UserID>545443</UserID>
		<UserName>Srinath</UserName>
		<UserDesignation>Solution Engineer</UserDesignation>
		<UserCity>Nellore</UserCity>
	</Userdata>
</Usersinfo>